{"schema_version":1.2,"project_id":"11111111-2222-4333-8444-555555555512","proof_ref":"MP-PP12A","grid":24,"sheet_profile":"sl680_0375","palette_id":"standard_v1","palette":[{"id":"snow_white","name":"Snow White","hex":"#ffffff"},{"id":"soft_cream","name":"Soft Cream","hex":"#f6ead8"},{"id":"warm_sand","name":"Warm Sand","hex":"#e3c9a3"},{"id":"honey_tan","name":"Honey Tan","hex":"#cfa06a"},{"id":"terracotta","name":"Terracotta","hex":"#b96a45"},{"id":"cocoa_brown","name":"Cocoa Brown","hex":"#7a4a2e"},{"id":"espresso","name":"Espresso","hex":"#4a2f22"},{"id":"charcoal","name":"Charcoal","hex":"#2b2b30"},{"id":"stone_gray","name":"Stone Gray","hex":"#9aa0a6"},{"id":"mist_gray","name":"Mist Gray","hex":"#d7dade"},{"id":"blush_pink","name":"Blush Pink","hex":"#f4b8c9"},{"id":"hot_pink","name":"Hot Pink","hex":"#e91e8c"},{"id":"brick_red","name":"Brick Red","hex":"#c23b3b"},{"id":"sunflower","name":"Sunflower","hex":"#f2c24b"},{"id":"amber","name":"Amber","hex":"#f59e0b"},{"id":"leaf_green","name":"Leaf Green","hex":"#5aa858"},{"id":"deep_teal","name":"Deep Teal","hex":"#0bbf92"},{"id":"sky_blue","name":"Sky Blue","hex":"#6fb3e0"},{"id":"deep_navy","name":"Deep Navy","hex":"#2c4a72"},{"id":"plum","name":"Plum","hex":"#7a4a7d"}],"cell_map":[16,17,17,17,17,16,17,17,17,17,16,17,17,17,17,16,17,17,17,17,16,17,17,17,17,17,17,17,16,17,17,17,17,16,17,17,17,17,16,17,17,17,17,16,17,17,17,17,17,17,17,16,17,17,17,17,16,17,17,17,17,16,17,17,17,17,16,17,17,17,17,16,17,17,16,17,17,17,17,16,17,6,6,6,6,6,6,6,17,16,17,17,17,17,16,17,17,16,17,17,17,17,16,17,6,6,6,6,6,6,6,6,6,17,17,13,17,16,17,17,16,17,17,17,17,16,17,6,6,6,3,3,3,3,3,6,6,6,13,14,13,17,17,17,17,17,17,17,16,17,6,6,6,3,3,3,3,3,3,3,6,6,6,13,17,17,17,17,17,17,17,16,17,17,6,6,3,3,3,3,3,3,3,3,3,6,6,17,17,17,17,16,17,17,16,17,17,17,6,5,3,3,3,3,3,3,3,3,3,5,6,17,17,17,16,17,17,16,17,17,17,17,16,3,3,2,2,2,2,2,2,2,2,2,17,17,17,16,17,17,16,17,17,17,17,16,17,3,3,5,1,1,1,2,2,5,2,2,17,17,16,17,17,17,17,17,17,17,16,17,17,3,3,6,1,1,1,2,2,6,2,2,17,16,17,17,17,17,17,17,17,16,17,17,17,3,3,2,1,1,1,2,2,2,2,2,16,17,17,17,17,16,17,17,16,17,17,17,17,3,3,2,2,2,2,2,2,2,2,2,17,17,17,17,16,17,17,16,17,17,17,17,16,17,3,2,2,10,10,10,2,3,3,17,17,17,17,16,17,17,16,17,17,17,17,16,17,17,3,2,2,2,2,2,2,3,3,17,17,17,16,17,17,17,17,17,17,17,16,17,17,17,17,2,4,4,4,4,4,3,17,17,17,16,17,17,17,17,17,17,17,16,17,17,17,17,16,17,2,2,2,2,2,17,17,17,16,17,17,17,17,16,17,17,16,17,17,17,17,16,17,17,17,17,16,17,17,17,17,16,17,17,17,17,16,17,17,16,17,17,17,18,18,18,18,18,18,18,16,16,16,16,16,16,16,17,17,16,17,17,16,17,17,17,17,18,18,18,18,18,18,18,16,16,16,16,16,16,16,17,16,17,17,17,17,17,17,18,18,18,18,18,18,18,18,18,18,18,18,18,18,18,18,18,18,17,17,17,17,17,17,18,18,18,18,18,18,18,18,18,18,18,18,18,18,18,18,18,18,17,17,16,17,17,16,18,18,18,18,18,18,18,18,18,18,18,18,18,18,18,18,18,18,17,16,17],"black_base":false,"kit":"Pixel Portrait 12 Demo","kit_format":"sticker","render_style":"pixel_portrait","pipeline_variant":"synthetic_demo","photo_category":"Other / Demo Portrait","proof_status":"sample_fixture","source":{"note":"synthetic 24x24 Pixel Portrait sample for supplier quoting; no private image data","upload_hash":"demo-pixel-portrait-12"},"cell_size_in":0.375,"finished_size_in":9.6,"preferred_size_in":12,"preferred_size_label":"12 in nominal format (legacy selection)"}
